{
  "name": "مجمع الإطلاق 39A",
  "tagline": "أطلقت جميع مهمات أبولو القمرية؛ واليوم تشغّل فالكون 9 وفالكون هيفي وكرو دراغون",
  "description": "بُنيت من أجل ساتورن 5، واحتُفظ بها للمكوك، ثم أُجِّرت لـSpaceX عام 2014. من المنصة A: أبولو 4 (أول ساتورن 5)، وأبولو 11 (أول هبوط على القمر)، وأبولو 13، وأبولو 17 (آخر هبوط على القمر)، وسكاي لاب، واثنتان وثمانون رحلة لمكوك الفضاء بما فيها أول رحلة STS-1، ومنذ 2017 كل فالكون هيفي وكل كرو دراغون إلى محطة الفضاء الدولية. نفس قناة اللهب، ونفس مسار الزحف، ثلاثة عصور من رحلات الفضاء المأهولة الأمريكية.",
  "best_known_for": "أطلقت جميع مهمات أبولو القمرية؛ واليوم تشغّل فالكون 9 وفالكون هيفي وكرو دراغون"
}
