{
  "name": "Cygnus Enhanced",
  "tagline": "Stretched Cygnus; UltraFlex round arrays",
  "description": "Northrop Grumman’s pressurised-cargo carrier, recognisable by its round UltraFlex solar arrays — a fan-fold accordion pattern shared with no other ISS visitor. Burns up on reentry; no downmass.",
  "best_known_for": "Stretched Cygnus; UltraFlex round arrays"
}
