{
  "name": "H3",
  "tagline": "Замена H-IIA/H-IIB по более низкой цене",
  "description": "H3 — орбитальный носитель, построенный Mitsubishi Heavy Industries в Японии. Заменяет H-IIA / H-IIB по более низкой цене. В эксплуатации с 2024 года.",
  "best_known_for": "Замена H-IIA/H-IIB по более низкой цене"
}
