{
  "name": "Baikonur Sito 31/6",
  "tagline": "Pad Soyuz con equipaggio attivo — ogni rotazione di equipaggio Soyuz verso la ISS dal 2020 è decollata dal Sito 31",
  "description": "L'altra metà dell'operazione Soyuz a Baikonur. Originariamente un pad ICBM R-7 dal 1961; modernizzato per Soyuz-2.1a nel 2014. Quando il Sito 1/5 è andato in manutenzione nel 2019, il Sito 31 ha rilevato l'intero programma di equipaggio Soyuz — ogni rotazione Soyuz MS verso la ISS dalla MS-16 nell'aprile 2020 è decollata da qui. Cadenza continua di volo umano: circa due equipaggi all'anno, senza interruzioni.",
  "best_known_for": "Pad Soyuz con equipaggio attivo — ogni rotazione di equipaggio Soyuz verso la ISS dal 2020 è decollata dal Sito 31"
}
