{
  "name": "AxEMU",
  "tagline": "Next-gen US EVA suit, clasificación para Artemis III",
  "description": "El traje EVA contratado de Axiom Space para el regreso lunar de Artemis de la NASA. Patrimonio de la UEM pero con articulaciones de movilidad comparables al A7LB de Apolo, un escrubber de CO2 de amina regenerable, video HD en el casco, y articulaciones resistentes al polvo para el uso de la superficie lunar. Estilismo de capa exterior de Prada. Actualmente en pruebas de calificación para Artemis III a finales de 2020s.",
  "best_known_for": "Traje US EVA de próxima generación siendo calificado para el aterrizaje lunar Artemis III"
}
