{
  "name": "Tianwen-1",
  "tagline": "Erste chinesische Mars-Mission; brachte Zhurong zur Oberfläche",
  "description": "Die erste Marsmission der CNSA — ein Orbiter, der den Rover Zhurong im Mai 2021 zur Marsoberfläche brachte. Nach dem Absetzen von Zhurong setzte der Orbiter seine wissenschaftlichen Arbeiten allein fort, darunter hochauflösende Bildgebung und Oberflächenkartierung.",
  "best_known_for": "Erste chinesische Mars-Mission; Orbiter brachte den Rover Zhurong im Mai 2021 zur Oberfläche"
}
