{
  "name": "بليسيتسك الموقع 43",
  "tagline": "منصة Soyuz العاملة في بليسيتسك عند 62.9°N — أعلى مجمع إطلاق مداري نشط في العالم من حيث خط العرض",
  "description": "يقع ميناء بليسيتسك الفضائي عند 62.9°N — وهو أعلى مجمع إطلاق مداري نشط من حيث خط العرض في العالم. يُعدّ الموقع 43 إحدى عدّة منصات في بليسيتسك ويعمل اليوم على إطلاق Soyuz-2 لحمولات روسية قطبية وMolniya وGLONASS. كانت في الأصل قاعدة R-7 للقذائف الباليستية في أواخر الخمسينيات، وأُعيد تكييفها لعمليات الإطلاق الفضائية في عام 1966، وعلى مدار عدة عقود احتفظت بليسيتسك بالرقم القياسي لأكثر عمليات الإطلاق المداري من أي موقع واحد على الأرض. يحد خط العرض المرتفع من مساهمة دوران الأرض (أقل من بايكونور أو وينتشانغ)، لكنه مثالي تماماً للمهام عالية الميل التي لا يستطيع بايكونور الوصول إليها بسهولة بدون مناورات الانعطاف الجانبي (dogleg).",
  "best_known_for": "أعلى موقع إطلاق مداري في العالم من حيث خط العرض الشمالي — منصة روسيا العسكرية القطبية / Molniya و GLONASS"
}
