{
  "name": "जिचांग LC-2",
  "tagline": "Long March 3A/3B परिवार — अधिकांश चीनी GTO व्यावसायिक प्रक्षेपण और Beidou GNSS की तैनाती",
  "description": "जिचांग उपग्रह प्रक्षेपण केंद्र के LC-2 ने अधिकांश चीनी भू-स्थैतिक कक्षीय व्यावसायिक प्रक्षेपण, Beidou/Compass नौसंचालन तारामंडल तथा Chang'e चंद्र कार्यक्रम को Long March 3A/3B/3C के माध्यम से अंजाम दिया है। पर्वतीय Sichuan प्रांत में स्थित यह स्थल कम अक्षांश का GTO लाभ तथा वर्ष-भर परिचालन उपलब्धता दोनों प्रदान करता है।",
  "best_known_for": "Long March 3A/3B GTO + Beidou GNSS"
}