{
  "name": "बायकोनूर साइट 1/5 (गगारिन का आरंभ)",
  "tagline": "Sputnik 1 (1957)। Vostok 1 — Gagarin (1961)। एक ही पैड से पाँच सौ चालीस Soyuz प्रक्षेपण।",
  "description": "दुनिया का सबसे ऐतिहासिक रूप से महत्वपूर्ण कक्षीय प्रक्षेपण पैड। 1957 से R-7 ICBM परीक्षण मंच; तुरंत 4 अक्टूबर, 1957 को Sputnik 1 के लिए पुनः उपयोग किया गया — अंतरिक्ष युग की शुरुआत। Yuri Gagarin यहाँ से 12 अप्रैल, 1961 को उठे। प्रत्येक Vostok दल, प्रत्येक Voskhod, सितंबर 2019 में MS-15 तक सभी Soyuz मैनिफेस्टों का बड़ा हिस्सा। बासठ वर्षों में एक पैड से पाँच सौ चालीस प्रक्षेपण। संग्रहालय स्मारक के रूप में संरक्षित; 2019-युग के जीर्णोद्धार की योजना को त्याग दिया गया जब साइट को 2025 में कजाकिस्तान को स्थानांतरित किया गया।",
  "best_known_for": "Sputnik 1 (1957)। Vostok 1 — Gagarin (1961)। एक ही पैड से पाँच सौ चालीस Soyuz प्रक्षेपण।"
}
