{
  "name": "Костюм SpaceX IVA",
  "tagline": "Белый стройный костюм Crew Dragon IVA, летавший с Demo-2",
  "description": "Разработанный SpaceX костюм для запуска. Однокомпонентные перчатки с сенсорным экраном для работы с планшетной консолью Crew Dragon, индивидуальные шлемы с 3D-печатью, установленные для каждого члена экипажа. Изношен для восхождения и повторного входа на Crew Dragon. Отличительная минималистская бело-черная эстетика.",
  "best_known_for": "Белый стройный костюм IVA надевался на каждый полет Crew Dragon со времен Demo-2"
}
