{
  "name": "YF-100",
  "tagline": "Motore kerolox a combustione in stadi della Cina, che alimenta la nuova generazione",
  "description": "L'YF-100 è il motore che ha portato la capacità di lancio della Cina nel livello di prestazioni che Russia e Stati Uniti avevano occupato per decenni. Sviluppato dall'AALPT a Xi'an, applica la combustione in stadi ricca di ossigeno a LOX e RP-1 — il ciclo termodinamico che estrae la massima energia dai propellenti cherosene — e volò per la prima volta il 20 settembre 2015. Due YF-100 alimentano lo stadio centrale del Long March 5, il razzo operativo più pesante della Cina, e varianti raggruppate volano sul Long March 6 e Long March 7. L'YF-100 sostiene il programma lunare della Cina, i suoi rifornimenti della stazione spaziale e la sua crescente cadenza di lanci commerciali.",
  "best_known_for": "Motore kerolox moderno a combustione in stadi della Cina — Long March 5/6/7"
}
