{
  "name": "Tiangong",
  "tagline": "Кинеска модуларна свемирска станица",
  "description": "Кинеска модуларна свемирска станица — Tianhe језгро плус Wentian и Mengtian научне лабораторије, потпуно састављене у октобру 2022. и континуирано настањене од јуна 2022. Отприлике маса и запремина Мира; једина тренутно оперативна свемирска станица ван ИСС-а.",
  "best_known_for": "Кинеска модуларна свемирска станица"
}
