{
  "name": "जिउक्वान SLC-43",
  "tagline": "चीन का मानवयुक्त अंतरिक्ष उड़ान पैड — हर शेनझोउ चालक दल, हर तियानझोउ कार्गो मिशन",
  "description": "पहला चीनी अंतरिक्ष प्रक्षेपण स्थल (1958), 1970 के बाद से परिचालन कक्षीय प्रक्षेपण, और 1999 के बाद से मानव अंतरिक्ष उड़ान का समर्पित घर: हर शेनझोउ चालक दल (2025 तक 1 से 19) ने SLC-43 पैड 91 से उड़ान भरी। तियानगोंग के लिए तियानझोउ कार्गो मिशन उसी परिसर से लॉन्ग मार्च 7 उड़ाते हैं। जिउक्वान गोबी रेगिस्तान में अंदरूनी हिस्से में 40.96°N पर स्थित है — वेनचांग द्वारा संभाली जाने वाली भूमध्यरेखीय ज्यामिति के लिए बहुत उत्तर में, लेकिन चीनी अंतरिक्ष गतिविधि का ऐतिहासिक केंद्र।",
  "best_known_for": "चीन का मानवयुक्त अंतरिक्ष उड़ान पैड — हर शेनझोउ चालक दल, हर तियानझोउ कार्गो मिशन"
}
