{
  "name": "Compton Gamma Ray Observatory",
  "tagline": "واحد من مرصدات ناسا الأربعة الكبرى",
  "description": "One of NASA’s four \"Great Observatories\" alongside Hubble, Chandra, and Spitzer. وفي المدار للفترة ١٩٩١-٢٠٠٠، رسمت سماء أشعة غاما واكتشفت أن انفجارات أشعة غاما تأتي من مسافات كونية بدلا من المصادر القريبة.",
  "best_known_for": "واحد من مرصدات ناسا الأربعة الكبرى"
}
