{
  "name": "ExoMars TGO",
  "tagline": "تحليل الغازات النزرة + ترحيل الاتصالات من السطح (ESA/NASA)",
  "description": "Trace Gas Orbiter من ESA، يدور حول المريخ منذ عام 2016. يقيس تركيز الميثان وبخار الماء في الغلاف الجوي، وهي مؤشرات محتملة على وجود حياة أو نشاط جيولوجي، وينقل البيانات لبعثات المريخ السطحية عبر جهاز إعادة التوجيه بنطاق UHF.",
  "best_known_for": "تحليل الغازات النزرة حول المريخ؛ إعادة توجيه البيانات لبعثات ESA و NASA السطحية"
}
