{
  "name": "Ариан 5",
  "tagline": "Розетта, JWST, Galileo (ESA)",
  "description": "Давний тяжелоатлет ЕКА вышел на пенсию в 2023 году после 117 запусков. В течение двух десятилетий «Розетта» перевозила кометы 67P, JWST к L2 и двойные геостационарные коммерческие полезные нагрузки.",
  "best_known_for": "Розетта, JWST, Galileo (ESA)"
}
