{
  "name": "Хамагир, Бриџит",
  "tagline": "Први сателит Француске, Astérix, лансиран ракетом Diamant A 1965. године",
  "description": "Хамагир је био француски ракетни полигон у алжирској Сахари, око 120 km југозападно од Бешара. Француска војска га је преко CIEES развијала од краја 1940-их за сондажне ракете и пројектиле. Његов комплекс Brigitte испитивао је ракете „драго камење“ (Agate, Topaze, Émeraude, Saphir, Rubis), које су довеле до ракете носача Diamant. Дана 26. новембра 1965. Diamant A је у орбиту избацио Astérix, први сателит Француске: Француска је постала трећа земља која је сателит лансирала сопственом ракетом, после Совјетског Савеза и Сједињених Држава. Три даља француска сателита уследила су 1966. и 1967. По евијанским споразумима Француска је задржала базу до јула 1967, а лансирања ракете Diamant тада су пребачена у Куру у Француској Гвајани. Са Хамагира је испаљено више од 270 ракета.",
  "best_known_for": "Први сателит Француске, Astérix, лансиран ракетом Diamant A 1965. године"
}
