{
  "name": "Inmarsat",
  "tagline": "Мобилне комуникације преко GEO сателита — поморство, ваздухопловство, окосница система GMDSS",
  "description": "Геостационарне мобилне сателитске комуникације — више од 14 сателита у GEO који пружају гласовне услуге и услуге преноса података за поморство, ваздухопловство и удаљена подручја. Првобитно основана 1979. као International Maritime Satellite Organization, међувладино тело утемељено уговором, за комуникацију између бродова и обале (претходница система GMDSS). Приватизована 1999. године. Купио ју је Viasat 2023. године ради спајања са флотом компаније Viasat у Ka-опсегу.",
  "best_known_for": "Мобилне комуникације преко GEO сателита — поморство, ваздухопловство, окосница система GMDSS"
}
