{
  "name": "Voyager 2",
  "tagline": "Nur Raumschiff, um alle vier riesigen Planeten zu besuchen",
  "description": "Das einzige Raumschiff, um alle vier riesigen Planeten zu besuchen — Jupiter (1979), Saturn (1981), Uranus (1986), Neptun (1989). Im November 2018 folgte der Zwilling Voyager 1 in interstellaren Raum. Tragt einen identischen Golden Record.",
  "best_known_for": "Nur Raumschiff, um alle vier riesigen Planeten zu besuchen"
}
