{
  "name": "Galileo (GNSS)",
  "tagline": "Europas ziviles GNSS — 28 Satelliten, Positionierung unter einem Meter",
  "description": "Europas ziviles GNSS — 28 Satelliten in 23.222 km MEO in 3 Orbitalebenen mit 56° Inklination. Erster operativer Dienst 2016, vollständige Einsatzfähigkeit erklärt 2024. Im Gegensatz zu GPS (militärischer Betreiber) und GLONASS (militärischer Betreiber) wird Galileo von EUSPA, einer zivilen EU-Behörde, verwaltet. Ausgelegt für Positionierung unter einem Meter mit offenen + kommerziellen + Public Regulated Service-Stufen. Search and Rescue-Nutzlast integriert zur Erkennung von Notfunkbaken.",
  "best_known_for": "Europas ziviles GNSS — 28 Satelliten, Positionierung unter einem Meter"
}
