{
  "name": "Jiuquan SLC-43",
  "tagline": "Plataforma de vuelo espacial tripulado de China — cada tripulación Shenzhou, cada misión de carga Tianzhou",
  "description": "El primer sitio de lanzamiento espacial chino (1958), lanzamientos orbitales operativos desde 1970, y desde 1999 el hogar dedicado del vuelo espacial humano: cada tripulación Shenzhou (1 a 19 a partir de 2025) ha despegado del SLC-43 Plataforma 91. Las misiones de carga Tianzhou hacia Tiangong vuelan Larga Marcha 7 desde el mismo complejo. Jiuquan se encuentra tierra adentro en el desierto de Gobi a 40.96°N — demasiado al norte para la geometría ecuatorial que maneja Wenchang, pero el centro histórico de la actividad espacial china.",
  "best_known_for": "Plataforma de vuelo espacial tripulado de China — cada tripulación Shenzhou, cada misión de carga Tianzhou"
}
