{
  "name": "R-7 / Foguetão Vostok",
  "tagline": "Transportado Sputnik e Gagarin para órbita",
  "description": "O lançador que colocou Sputnik em órbita em 1957 e Yuri Gagarin no espaço em 1961. Um ancestral direto de cada foguete Soyuz voou desde então — a linhagem de produção mais longa em vôos espaciais, com milhares de voos em seis décadas.",
  "best_known_for": "Transportado Sputnik e Gagarin para órbita"
}
