{
  "name": "Xichang LC-3",
  "tagline": "Primeiros sucessos operacionais do CZ-3 — primeiro sucesso GTO do DFH-2, era Apstar / Asiasat / Sinosat",
  "description": "O Xichang LC-3 sediou a primeira tentativa de lançamento do Long March 3 em 29 de janeiro de 1984 (DFH-2-01), que falhou parcialmente na reignição do terceiro estágio. O primeiro voo bem-sucedido do Long March 3 ocorreu em 8 de abril de 1984 (DFH-2-02), que pôs o satélite de comunicações DFH-2 “Dong Fang Hong-2” em órbita de transferência geoestacionária — o primeiro sucesso da China em GTO. Os dois voos do CZ-3 partiram do LC-3. Durante a década de 1990, apoiou muitos lançamentos comerciais de comunicações Apstar, Asiasat e Sinosat. Hoje continua em uso ativo ao lado do LC-2 nas operações do Long March 3B.",
  "best_known_for": "Primeiro sucesso chinês em GTO (1984) + satélites de comunicação"
}
